{
  "$schema": "https://artex-x.github.io/daggerheart-loot/schema/import-v1.json",
  "format": "daggerheart-loot/lists",
  "version": 1,
  "exported_at": "2026-09-25T12:00:00.000Z",
  "lists": [
    {
      "name": "Пустой список",
      "entries": []
    },
    {
      "name": "Лавка кузнеца",
      "money_mode": "coin",
      "player_note": "Открыта с рассвета до заката.",
      "gm_note": "Кузнец торгуется, если назвать имя его брата.",
      "entries": [
        {
          "id": "ci1",
          "name": "Первоклассный Спальный Мешок",
          "quantity": 2,
          "price_coins": 150
        },
        {
          "id": "q1",
          "name": "Палаш",
          "player_note": "Последний в наличии."
        },
        {
          "id": "q313",
          "name": "Стеганый Доспех"
        },
        {
          "id": "cc1",
          "name": "Зелье Быстрого Шага",
          "quantity": 5,
          "price_coins": 20
        },
        {
          "id": "voa2_a3",
          "name": "Колода Сумерек",
          "gm_note": "Проклят."
        },
        {
          "id": "q23",
          "name": "Скипетр"
        },
        {
          "id": "w51",
          "name": "Гарпун Левиафана",
          "price_coins": 99999
        },
        {
          "id": "q35",
          "name": "Колдующий Кинжал"
        },
        {
          "id": "di11",
          "name": "Брошюра по Истории Искусства"
        }
      ]
    },
    {
      "name": "Трофеи",
      "entries": [
        {
          "id": "q1",
          "name": "Палаш"
        },
        {
          "id": "ci1",
          "name": "Первоклассный Спальный Мешок"
        }
      ]
    }
  ]
}
